{
  "entry_id": "e1b2c3d4e5f60718293a4b5c6d7e8f94",
  "player_id": "00000000000000000000000000000001",
  "delta_points": -2000,
  "reason": "spend_on_buyin",
  "occurred_at": "2026-06-10T19:05:00",
  "related_ledger_entry_id": "a1b2c3d4e5f60718293a4b5c6d7e8f90",
  "session_id": "9f8e7d6c5b4a39281706f5e4d3c2b1a0"
}
